{
  "$schema": "https://github.com/glzr-io/zebar/raw/v3.0.0/resources/zpack-schema.json",
  "name": "starter",
  "version": "0.0.0",
  "description": "A basic widget pack for testing and development.",
  "tags": [
    "topbar"
  ],
  "previewImages": [
    "./resources/preview-image-1.png"
  ],
  "repositoryUrl": "",
  "widgets": [
    {
      "name": "vanilla",
      "htmlPath": "./vanilla.html",
      "zOrder": "normal",
      "shownInTaskbar": false,
      "focused": false,
      "resizable": false,
      "transparent": true,
      "includeFiles": [
        "*.html",
        "*.css",
        "*.png"
      ],
      "caching": {
        "defaultDuration": 604800,
        "rules": []
      },
      "privileges": {
        "shellCommands": []
      },
      "presets": [
        {
          "name": "default",
          "anchor": "top_left",
          "offsetX": "0px",
          "offsetY": "0px",
          "width": "100%",
          "height": "40px",
          "monitorSelection": {
            "type": "all"
          },
          "dockToEdge": {
            "enabled": false,
            "edge": null,
            "windowMargin": "0px"
          }
        }
      ]
    },
    {
      "name": "with-ninja",
      "htmlPath": "./with-ninja.html",
      "zOrder": "normal",
      "shownInTaskbar": false,
      "focused": false,
      "resizable": true,
      "transparent": true,
      "includeFiles": [
        "*.html",
        "*.css",
        "*.png"
      ],
      "caching": {
        "defaultDuration": 604800,
        "rules": []
      },
      "privileges": {
        "shellCommands": []
      },
      "presets": [
        {
          "name": "default",
          "anchor": "top_left",
          "offsetX": "0px",
          "offsetY": "0px",
          "width": "100%",
          "height": "40px",
          "monitorSelection": {
            "type": "all"
          },
          "dockToEdge": {
            "enabled": false,
            "edge": null,
            "windowMargin": "0px"
          }
        }
      ]
    },
    {
      "name": "with-komorebi",
      "htmlPath": "./with-komorebi.html",
      "zOrder": "normal",
      "shownInTaskbar": false,
      "focused": false,
      "resizable": true,
      "transparent": true,
      "includeFiles": [
        "*.html",
        "*.css",
        "*.png"
      ],
      "caching": {
        "defaultDuration": 604800,
        "rules": []
      },
      "privileges": {
        "shellCommands": []
      },
      "presets": [
        {
          "name": "default",
          "anchor": "top_left",
          "offsetX": "0px",
          "offsetY": "0px",
          "width": "100%",
          "height": "40px",
          "monitorSelection": {
            "type": "all"
          },
          "dockToEdge": {
            "enabled": false,
            "edge": null,
            "windowMargin": "0px"
          }
        }
      ]
    }
  ]
}
